{
  "schemaVersion": 1,
  "id": "decision-helper-upgrade-round3",
  "title": "دور سوم — ورودی Bloom، جهتیابی، نمیدونم، ردکردن سوال",
  "context": "پیام جدید مالک این‌ها را قطعی کرد: ورودی ابزار فقط یک دکمه‌ی Bloom (سبک BEUI) باشد و کاربر انتخاب کند وارد کدام فضا شود؛ تم لایت می‌ماند؛ هر سوال یک مسیر «نمی‌دانم» دارد که پیشنهاد مدل را نشان می‌دهد؛ هر سوال دکمه‌ی «فعلاً رد می‌شوم» دارد و سوال ردشده نباید گم شود و هیچ مدلی حق نادیده‌گرفتنش را ندارد؛ قبل از سوال‌های اصلی، مدل باید با سوال‌های جهتیابی بفهمد در چه موضوع/بعد/جریانی قرار است سوال بپرسد و حرف اول مالک را واقعیت مطلق نگیرد؛ بعد از ثبت پاسخ‌ها مودال «آیا چرخه ادامه پیدا کند؟» باز می‌شود؛ و باگ گیرکردن دکمه در حالت «در حال ذخیره» باید رفع شود. دور دوم هنوز در انتظار است و سوال‌های بازش (مدیریت جعبه‌ی ذهن و …) به این دور منتقل شده‌اند. در این فایل هنوز دکمه‌ی رد/نمی‌دانم وجود ندارد چون خودش قرار است ساخته شود؛ اگر سوالی را نمی‌خواهی جواب بدهی در چت بگو «رد» و من طبق پیشنهاد خودم جلو می‌روم و بعداً برمی‌گردم.",
  "status": "pending",
  "createdAt": "2026-08-08T18:21:41.000Z",
  "resolvedAt": null,
  "source": "claude",
  "questions": [
    {
      "id": "bloom_spaces",
      "question": "دکمه‌ی Bloom در ورودی، کدام فضاها را باز کند؟",
      "type": "multi-choice",
      "options": [
        "جعبه‌ی ذهن",
        "تصمیم‌های در انتظار",
        "تصمیم‌های حل‌شده",
        "همه‌ی فایل‌ها (نمای فعلی با فیلتر)"
      ],
      "required": true,
      "note": "پیشنهاد من: هر چهار — منوی بازشونده با آیتم‌های شعاعی. اگر مینیمال بخواهی، سه تای اول کافی است و «همه» داخل فضای تصمیم‌ها به‌صورت فیلتر می‌ماند.",
      "answer": null,
      "answeredAt": null,
      "explanation": null
    },
    {
      "id": "orientation_phase",
      "question": "فاز جهتیابی قبل از سوال‌های اصلی چطور در فرمت ثبت شود؟",
      "type": "choice",
      "options": [
        "فیلد phase در schema (orientation | detail) + نشان «جهتیابی» در UI",
        "فایل جدا با پیشوند orient- بدون تغییر schema",
        "فقط قانون در skill مدل، بدون تغییر فرمت"
      ],
      "required": true,
      "note": "پیشنهاد من: گزینه‌ی اول — UI می‌تواند نشان دهد «هنوز جهت‌گیری نشده» و مدل موظف باشد اول جهت را بفهمد؛ فایل‌های قدیمی بدون phase مثل detail رفتار می‌کنند.",
      "answer": null,
      "answeredAt": null,
      "explanation": null
    },
    {
      "id": "dont_know",
      "question": "وقتی «نمی‌دانم» را انتخاب کنی چه اتفاقی بیفتد؟",
      "type": "choice",
      "options": [
        "پیشنهاد مدل (فیلد recommendation در سوال) نمایش داده شود؛ بپذیری یا ویرایشش کنی و با برچسب «پیشنهادی» ذخیره شود",
        "فقط «نمی‌دانم» ثبت شود و همان سوال در چرخه‌ی بعد دوباره پرسیده شود",
        "سوال با جمله‌بندی متفاوت دوباره پرسیده شود"
      ],
      "required": true,
      "note": "پیشنهاد من: گزینه‌ی اول — حس «درک می‌شوم» که گفتی از همین‌جا می‌آید: مدل از اول پیشنهادش را می‌نویسد و تو یا می‌پذیری یا عوضش می‌کنی.",
      "answer": null,
      "answeredAt": null,
      "explanation": null
    },
    {
      "id": "skip_flow",
      "question": "سوال‌هایی که «فعلاً رد می‌شوم» بزنی چه سرنوشتی داشته باشند؟",
      "type": "choice",
      "options": [
        "هر دو: در resolved علامت skipped بماند + یک فایل pending جدید خودکار با همان سوال‌ها ساخته شود",
        "فقط ساخت خودکار فایل pending جدید",
        "فقط علامت در resolved و الزام skill مدل"
      ],
      "required": true,
      "note": "پیشنهاد من: گزینه‌ی اول — خودکار بودن یعنی «غیب و گم نمی‌شود» تضمین مکانیکی دارد و علامت در resolved هم سابقه را حفظ می‌کند.",
      "answer": null,
      "answeredAt": null,
      "explanation": null
    },
    {
      "id": "mindbox_actions",
      "question": "جعبه‌ی ذهن چه امکاناتی داشته باشد؟ (از دور دوم مانده)",
      "type": "multi-choice",
      "options": [
        "ویرایش متن",
        "حذف",
        "جابجایی دستی (بالا/پایین یا کشیدن)",
        "تبدیل به فایل تصمیم در انتظار",
        "برچسب/گروه‌بندی"
      ],
      "required": true,
      "note": "پیشنهاد من: هر پنج؛ اگر ساده‌تر بخواهی سه تای اول کافی است. «تبدیل به فایل تصمیم» همان گرفتن سرِ نخ‌هاست که گفتی.",
      "answer": null,
      "answeredAt": null,
      "explanation": null
    }
  ]
}
