{
  "schemaVersion": 1,
  "id": "decision-helper-upgrade-plan",
  "title": "تغییر محیط و قابلیت جدید Decision Helper",
  "context": "مالک می‌خواهد محیط Decision Helper را کمی تغییر دهد و یک قابلیت جدید به آن اضافه کند. این جلسه با خود ابزار گرفته می‌شود؛ این فایل اولین دور پرسش‌هاست و بر اساس پاسخ‌ها شاخه‌بندی ادامه پیدا می‌کند.",
  "status": "resolved",
  "createdAt": "2026-08-08T17:59:43.000Z",
  "resolvedAt": "2026-08-08T18:05:52.849Z",
  "source": "claude",
  "questions": [
    {
      "id": "scope_environment",
      "question": "«محیط» Decision Helper که می‌خواهی تغییر بدهی، کدام بخش‌ها را شامل می‌شود؟",
      "type": "multi-choice",
      "options": [
        "ظاهر و تجربه UI (تم، رنگ، چیدمان، فونت)",
        "سرور و API (مسیرها، ذخیره‌سازی، متغیرهای محیطی)",
        "فرمت فایل و schema تصمیم",
        "اسکریپت‌ها و workflow (pnpm decisions، skill مدل)"
      ],
      "required": true,
      "note": "پیشنهاد من: از ظاهر UI شروع کن — README می‌گوید دارک است ولی کد فعلاً تم روشن دارد؛ به نظر یک ناهماهنگی واقعی است. هر بخشی را انتخاب کنی، دور بعد جزئیاتش را می‌پرسم.",
      "answer": [
        "اسکریپت‌ها و workflow (pnpm decisions، skill مدل)"
      ],
      "answeredAt": "2026-08-08T18:05:52.849Z",
      "explanation": "نه  باید لایت باشه نمیخوام دارک باشه همین جوری خوبه اما با استفاده از be ui که خیلی شیک هست الان صفحه وسط و همه چیز کارت تو کارت شده خیلی زشت شده من مجبور شدم یک گزینه الکی انتخاب کنم چون توضیح خودم رو بعنوان یک جواب به رسمیت نمیشناخت اینم یک باگ دیگه"
    },
    {
      "id": "new_capability",
      "question": "قابلیت جدیدی که می‌خواهی اضافه بشود دقیقاً چیست؟ (آزاد بنویس؛ بعداً به سوال‌های عینی شاخه می‌زنم)",
      "type": "text",
      "required": true,
      "note": "مثلاً: نوع سوال جدید، خروجی/گزارش، جستجو، برچسب/فیلتر، یادآوری، یا هر چیز دیگری. هرچه در ذهن داری بنویس.",
      "answer": "میخوام یک چیزی قبل ا ز این چیز باشه یعنی من میخوام  اینجا یک باکس داشته باشم که هر چیزی که به ذهنم میرسه هر تصمیم نگرفته ای و هر چیزی که توی سرم میاد و گره ها و تصمیمات معلق و چیزایی که باید برنامه ریزی کنم و همه چیز دوست دارم این باکس یک فیلد ورودی داشته باشه که من تند تند تایپ کنم و هر بار اینتر میزنم همون چیزی که تایپ کردم میوفته توی باکس این باکس خیلی شلوغ پبوغ و پر از سوال و متن ها و چیز هایی خواهد بود که توی ذهنم میادیعنی ممکنه هیچ چیزی به هیچ چیز دیگه هم ربط نداشته باشه و فقط توش پر از سر نخ باشه که این سر نخ هارو بشه گرفت و اونارو دوباره مرتب سازی کرد خودم باید این کارو انجام بدم ",
      "answeredAt": "2026-08-08T18:05:52.849Z",
      "explanation": null
    },
    {
      "id": "capability_audience",
      "question": "قابلیت جدید بیشتر برای چه کسی باید کار کند؟",
      "type": "choice",
      "options": [
        "مالک در UI (پاسخ‌دهنده)",
        "مدل/اسکیل (نویسنده فایل‌ها)",
        "هر دو"
      ],
      "required": true,
      "note": "پیشنهاد من: هر دو، مگر اینکه قابلیت ذاتاً UI-only باشد. این جواب تعیین می‌کند تغییر در کجا (سرور/UI/schema/skill) بنشیند.",
      "answer": "هر دو",
      "answeredAt": "2026-08-08T18:05:52.849Z",
      "explanation": null
    },
    {
      "id": "zero_dependency",
      "question": "محدودیت «بدون وابستگی» برای این تغییر حفظ بشود؟",
      "type": "choice",
      "options": [
        "بله، بدون وابستگی بماند",
        "وابستگی سبک مجاز است",
        "مهم نیست"
      ],
      "required": false,
      "note": "پیشنهاد من: بله حفظ شود — این نقطه‌ی قوت فعلی ابزار است و README روی آن تأکید دارد.",
      "answer": "بله، بدون وابستگی بماند",
      "answeredAt": "2026-08-08T18:05:52.849Z",
      "explanation": null
    },
    {
      "id": "docs_sync",
      "question": "تغییر شامل همگام‌سازی مستندات (README، schema.json، skill مدل) هم بشود؟",
      "type": "choice",
      "options": [
        "بله، همه مستندات هماهنگ بشوند",
        "فقط README",
        "فقط کد، مستندات بعداً"
      ],
      "required": false,
      "note": "پیشنهاد من: بله همه — چون skill مدل و schema عملاً قرارداد ابزار هستند و اگر هماهنگ نباشند، جریان تصمیم‌گیری می‌شکند.",
      "answer": "بله، همه مستندات هماهنگ بشوند",
      "answeredAt": "2026-08-08T18:05:52.849Z",
      "explanation": null
    }
  ]
}
