{
  "schemaVersion": 1,
  "id": "mindbox-project-orientation",
  "title": "جهت‌یابی — پروژه‌ی حرفه‌ای جعبه‌ی ذهن",
  "context": "مالک می‌گوید ایده‌ی جعبه‌ی ذهن باید خیلی بیشتر از یک باکس ساده رشد کند و می‌خواهد یک پروژه‌ی حرفه‌ای از آن بسازد. طبق قانون خودش، قبل از هر سوال جزئی، اول باید جهت‌گیری کنیم: موضوع چیست، برای چه کسی است، مشکل اصلی کدام است و قرار است در چه جریانی بچرخد. جواب‌های تو واقعیت مطلق نیستند — من ممکن است برداشتم را اشتباه کرده باشم و این سوال‌ها برای همین است که مطمئن شوم در مسیر اشتباه شروع نمی‌کنم. اگر سوالی را نمی‌خواهی جواب بدهی، در چت بگو «رد»؛ دور سوم ارتقای Decision Helper همچنان در انتظار می‌ماند و گم نمی‌شود.",
  "status": "pending",
  "createdAt": "2026-08-08T18:37:21.000Z",
  "resolvedAt": null,
  "source": "claude",
  "questions": [
    {
      "id": "vision_scale",
      "question": "این ایده در نهایت در چه مقیاسی باید بچرخد؟",
      "type": "choice",
      "options": [
        "هر دو: به‌عنوان محصول مستقل رشد کند ولی با تصمیم‌ها در ارتباط باشد",
        "یک اپ/محصول مستقل و حرفه‌ای جدا",
        "قلب خود Decision Helper بشود و کل ابزار دور آن بزرگ شود",
        "نمی‌دانم — پیشنهادت چیست؟"
      ],
      "required": true,
      "note": "پیشنهاد من: گزینه‌ی اول — گفتی «خیلی باید بیشتر از این رشد کند»؛ مستقل‌بودن به آن سقف نمی‌دهد و ارتباط با تصمیم‌ها همان سرِ نخ‌هایی است که در جعبه می‌خواهی.",
      "answer": null,
      "answeredAt": null,
      "explanation": null
    },
    {
      "id": "core_problem",
      "question": "مهم‌ترین مشکلی که این پروژه باید برایت حل کند چیست؟ (آزاد بنویس، حتی اگر ناقص است)",
      "type": "text",
      "required": true,
      "note": "نگو می‌خواهیم چه بسازیم؛ بگو الان چه چیزی اذیتت می‌کند: مغز شلوغ؟ گره‌های معلق؟ از دست رفتن افکار؟ نبود ساختار؟ اگر مطمئن نیستی، «رد» بگو تا از روی حرف‌های قبلی‌ات برداشت کنم.",
      "answer": null,
      "answeredAt": null,
      "explanation": null
    },
    {
      "id": "audience",
      "question": "اولین مصرف‌کننده‌ی این پروژه کیست؟",
      "type": "choice",
      "options": [
        "فقط خودم",
        "خودم + چند نفر آشنا",
        "محصول عمومی",
        "نمی‌دانم — پیشنهادت چیست؟"
      ],
      "required": true,
      "note": "پیشنهاد من: فقط خودت شروع کن — محصول حرفه‌ای اول با یک کاربر عاشق ساخته می‌شود و بعد بزرگ می‌شود.",
      "answer": null,
      "answeredAt": null,
      "explanation": null
    },
    {
      "id": "professional_meaning",
      "question": "به نظر تو «حرفه‌ای‌بودن» این پروژه یعنی چه؟ (چند مورد می‌توانی انتخاب کنی)",
      "type": "multi-choice",
      "options": [
        "ذخیره‌ی امن و بدون از دست رفتن داده",
        "سازمان‌دهی: دسته، برچسب، جستجو",
        "اتصال به تصمیم‌گیری و workflow مدل‌ها",
        "UI/UX شیک، سریع و لذت‌بخش",
        "بازبینی افکار در طول زمان (تاریخچه و رشد)"
      ],
      "required": true,
      "note": "پیشنهاد من: هر پنج، اما اگر بخواهی اولویت بدهی: بدون از دست رفتن داده و UI لذت‌بخش اول. اگر مطمئن نیستی، «رد» بگو.",
      "answer": null,
      "answeredAt": null,
      "explanation": null
    },
    {
      "id": "relation_to_helper",
      "question": "رابطه‌اش با Decision Helper فعلی چه باشد؟",
      "type": "choice",
      "options": [
        "جعبه‌ی ذهن قلب ابزار شود و تصمیم‌ها از دل سرنخ‌های آن بیرون بیایند",
        "دو ابزار جدا که با هم حرف می‌زنند",
        "فعلاً مستقل؛ بعداً درباره‌ی اتصال تصمیم می‌گیریم",
        "نمی‌دانم — پیشنهادت چیست؟"
      ],
      "required": true,
      "note": "پیشنهاد من: گزینه‌ی اول — «گرفتن سرِ نخ» که گفتی یعنی همین: هر فکر در جعبه می‌نشیند و هر کدام می‌توانند به یک تصمیم/فایل تبدیل شوند.",
      "answer": null,
      "answeredAt": null,
      "explanation": null
    }
  ]
}
