{
  "schemaVersion": 1,
  "id": "decision-helper-upgrade-round2",
  "title": "دور دوم — بازطراحی BEUI، جعبه‌ی ذهن و رفع باگ پاسخ",
  "context": "خلاصه‌ی دور اول: تم لایت می‌ماند (README اشتباه «دارک» گفته است)، ظاهر با زبان بصری BEUI بازطراحی می‌شود تا «کارت‌توکارت» حذف شود؛ قابلیت جدید «جعبه‌ی ذهن» برای ریختن سریع افکار/گره‌های معلق قبل از فایل‌های تصمیم ساخته می‌شود؛ برای هر دو (مالک در UI و مدل/اسکیل) کار می‌کند؛ بدون وابستگی می‌ماند؛ همه مستندات هماهنگ می‌شوند؛ و باگ «توضیح به‌عنوان جواب شناخته نمی‌شود» باید رفع شود.",
  "status": "pending",
  "createdAt": "2026-08-08T18:07:56.000Z",
  "resolvedAt": null,
  "source": "claude",
  "questions": [
    {
      "id": "beui_approach",
      "question": "چطور BEUI را به Decision Helper بیاوریم در حالی که «بدون وابستگی» حفظ می‌شود؟",
      "type": "choice",
      "options": [
        "همان زبان بصری BEUI به HTML فعلی منتقل شود (دکمه‌های قرصی، ریپل، توکن‌های رنگ، انیمیشن‌های ظریف)",
        "به اپ React با کامپوننت‌های واقعی BEUI تبدیل شود (وابستگی اضافه می‌شود)",
        "فقط بخشی از استایل کپی شود"
      ],
      "required": true,
      "note": "پیشنهاد من: گزینه‌ی اول — چون صراحتاً گفتی بدون وابستگی بماند و ابزار «یک فایل HTML + یک سرور Node» است. نتیجه از نظر ظاهری خیلی نزدیک به BEUI می‌شود ولی همچنان با یک دبل‌کلیک/دستور اجرا می‌شود.",
      "answer": null,
      "answeredAt": null,
      "explanation": null
    },
    {
      "id": "mindbox_placement",
      "question": "جعبه‌ی ذهن کجا نمایش داده شود؟",
      "type": "choice",
      "options": [
        "تب اول «جعبه‌ی ذهن» قبل از تب‌های فایل‌ها",
        "بالای لیست فایل‌ها در همان صفحه",
        "صفحه‌ی جدا با دکمه در هدر"
      ],
      "required": true,
      "note": "پیشنهاد من: تب اول — چون گفتی «قبل از این چیز باشد» و با گذشت زمان اگر شلوغ شود، تب جدا بهتر از یک باکس بالای لیست است.",
      "answer": null,
      "answeredAt": null,
      "explanation": null
    },
    {
      "id": "mindbox_storage",
      "question": "داده‌های جعبه‌ی ذهن کجا ذخیره شود؟",
      "type": "choice",
      "options": [
        "پوشه‌ی جدا مثل brain-dump/ با یک فایل brain-dump.json",
        "فایل brain-dump.json داخل decision-inbox",
        "هر آیتم یک فایل JSON جدا"
      ],
      "required": true,
      "note": "پیشنهاد من: پوشه‌ی جدا با یک فایل — چون decision-inbox فعلاً همه‌ی *.json را به‌عنوان فایل تصمیم می‌خواند و مخلوط‌شدن جعبه‌ی ذهن با آن لیست را به هم می‌ریزد. چون گفتی برای «هر دو» است، فایل JSON لازم است تا skill مدل هم بتواند بخواند و بنویسد.",
      "answer": null,
      "answeredAt": null,
      "explanation": null
    },
    {
      "id": "mindbox_actions",
      "question": "برای مدیریت آیتم‌های جعبه‌ی ذهن چه امکاناتی لازم است؟ (چند مورد می‌توانی انتخاب کنی)",
      "type": "multi-choice",
      "options": [
        "ویرایش متن آیتم",
        "حذف آیتم",
        "جابجایی دستی (بالا/پایین یا کشیدن)",
        "تبدیل آیتم به فایل تصمیم در انتظار",
        "برچسب/گروه‌بندی"
      ],
      "required": true,
      "note": "پیشنهاد من: هر پنج — اما اگر بخواهی حداقلی بماند، ویرایش + حذف + جابجایی کافی است؛ تبدیل به فایل تصمیم همان «گرفتن سرِ نخ‌ها»ست و با جریان فعلی ابزار خیلی طبیعی جور می‌شود.",
      "answer": null,
      "answeredAt": null,
      "explanation": null
    },
    {
      "id": "custom_answer_fix",
      "question": "باگ «توضیح به‌عنوان جواب شناخته نمی‌شود» چطور رفع شود؟",
      "type": "choice",
      "options": [
        "برای سوال‌های انتخابی، گزینه‌ی «پاسخ دلخواه» با فیلد متنی اضافه شود",
        "اگر فیلد توضیح پر باشد، همان به‌عنوان پاسخ ثبت شود",
        "هر دو"
      ],
      "required": true,
      "note": "پیشنهاد من: گزینه‌ی اول — جواب واقعی وارد فیلد answer می‌شود و توضیح (دلیل) جای خودش می‌ماند؛ معنا تمیزتر است و مدل موقع خواندن سردرگم نمی‌شود.",
      "answer": null,
      "answeredAt": null,
      "explanation": null
    }
  ]
}
