{
  "schemaVersion": 1,
  "id": "mindbox-options",
  "title": "اپشن‌های پروژه‌ی جعبه‌ی ذهن",
  "context": "مالک فلو را در جعبه‌ی ذهن توضیح داد: شروع خالی، فقط یک اینپوت وسط (کمی بالاتر از مرکز)، اینتر → بلوک با قانون گرانش می‌افتد و بدون نظم روی هم تلمبار می‌شود و یک دکمه‌ی سه‌نقطه در گوشه که مالک می‌خواهد من پیشنهادش را بدهم. هدف: سروسامان دادن به همین افکار برای آدم‌های ADHD. تحقیق پشتیبان: مغز برای تولید ایده است نه نگه‌داری آن (GTD)؛ «اول بگیر، بعد مرتب کن»؛ رابط تخت و آرام؛ اثر زایگارنیک (چیزهای ناتمام ذهن را اشغال می‌کنند)؛ اصطکاک کم = عادت. فایل جهت‌گیری همچنان پندینگ است و گم نمی‌شود.",
  "status": "pending",
  "createdAt": "2026-08-08T18:52:31.000Z",
  "resolvedAt": null,
  "source": "claude",
  "questions": [
    {
      "id": "capture_flow",
      "question": "فلو هسته همین باشد؟ شروع خالی، اینپوت وسط (کمی بالاتر)، اینتر → بلوک با گرانش می‌افتد و تلمبار می‌شود",
      "type": "choice",
      "options": [
        "بله، دقیقاً همین",
        "بله، ولی بلوک‌ها کمی مرتب‌تر بیفتند",
        "چیزی دیگر — در توضیح بنویس"
      ],
      "required": true,
      "note": "پیشنهاد من: گزینه‌ی اول — این «گرفتنِ بی‌قضاوت» دقیقاً همان چیزی است که تحقیق برای ADHD می‌گوید؛ نظم را به حالت مرتب‌سازی بعداً منتقل می‌کنیم.",
      "answer": null,
      "answeredAt": null,
      "explanation": null
    },
    {
      "id": "sort_mode",
      "question": "مرتب‌سازی کِی انجام شود؟",
      "type": "choice",
      "options": [
        "در حالت جدا (حالت مرتب‌سازی) که خودم روشنش می‌کنم",
        "همان لحظه با کشیدن بلوک‌ها",
        "مدل خودش پیشنهاد مرتب‌سازی بدهد",
        "نمی‌خواهم مرتب کنم؛ فقط می‌ریزم"
      ],
      "required": true,
      "note": "پیشنهاد من: گزینه‌ی اول — تحقیق می‌گوید capture و organize باید جدا باشند؛ هنگام ریختن، هیچ‌چیز حواس را پرت نکند.",
      "answer": null,
      "answeredAt": null,
      "explanation": null
    },
    {
      "id": "dots_menu",
      "question": "دکمه‌ی سه‌نقطه‌ی گوشه چه چیزهایی داشته باشد؟ (چند مورد می‌توانی انتخاب کنی)",
      "type": "multi-choice",
      "options": [
        "تبدیل به تصمیم (ارسال به Decision Helper)",
        "حالت مرتب‌سازی",
        "جستجو",
        "خلاصه/بازبینی با مدل",
        "تنظیمات"
      ],
      "required": true,
      "note": "پیشنهاد من: هر پنج — «تبدیل به تصمیم» همان گرفتن سرِ نخ و فرستادنش به جریان تصمیم‌گیری است؛ بقیه هم ابزارهای اصلی مرتب‌سازی بعدی‌اند.",
      "answer": null,
      "answeredAt": null,
      "explanation": null
    },
    {
      "id": "adhd_features",
      "question": "بر اساس تحقیق، کدام قابلیت‌ها را می‌خواهی؟ (چند مورد می‌توانی انتخاب کنی)",
      "type": "multi-choice",
      "options": [
        "باز شدن آنی و صفر اصطکاک (همین اینپوت تنها)",
        "پیشنهاد مدل بعد از «سلام»: می‌خواهی به جعبه‌ات سر بزنم؟",
        "بازبینی آرام و کم‌تحریک (بدون استرس)",
        "استخراج «قدم بعدی» از سرنخ‌ها",
        "ورودی سریع با صدا (بعداً)"
      ],
      "required": true,
      "note": "پیشنهاد من: چهار تای اول؛ صدا را می‌گذاریم برای بعد. «قدم بعدی» همان چیزی است که محصولات خوب ADHD به‌جای لیست طولانی می‌دهند.",
      "answer": null,
      "answeredAt": null,
      "explanation": null
    },
    {
      "id": "next_step",
      "question": "قدم بعدی بعد از این تصمیم‌ها چیست؟",
      "type": "choice",
      "options": [
        "پیاده‌سازی همین فلو و گرانش بلوک‌ها در ابزار فعلی",
        "اول ساختار داده و skill مدل",
        "اول ظاهر حرفه‌ای (BEUI کامل)",
        "نظرت چیست؟"
      ],
      "required": true,
      "note": "پیشنهاد من: گزینه‌ی اول — حس «بهشت بودن» از همین فلو می‌آید؛ بقیه روی آن سوار می‌شوند.",
      "answer": null,
      "answeredAt": null,
      "explanation": null
    }
  ]
}
